{
  "status": "passed",
  "reviewer": "creative-director",
  "reviewed_at": "2026-08-13T12:00:00Z",
  "changed": ["Reduced proof-rail contrast"],
  "stayed": ["Evidence remains attached to its claim"],
  "why": ["Preserve rigor while keeping content primary"],
  "before": {"path": ".continuity/private/designs/example/1/concept-a-wide.png", "sha256": "0000000000000000000000000000000000000000000000000000000000000001"},
  "after": {"path": ".continuity/private/designs/example/2/concept-a-wide.png", "sha256": "0000000000000000000000000000000000000000000000000000000000000002"},
  "path": ".continuity/private/designs/example/2/visual-delta.png",
  "sha256": "0000000000000000000000000000000000000000000000000000000000000000"
}
